{
  "_meta": {
    "auto_generated": true,
    "generated_by": "python3/src/stock_ticker/hugo_generators.py :: generate_strategy_filters()",
    "generated_at": "2026-10-28T16:42:19.462385",
    "warning": "DO NOT EDIT - This file is automatically generated and will be overwritten"
  },
  "strategy": "Moon Shot",
  "strategy_key": "moon_shot",
  "description": "High volatility growth stocks (beta > 1.5, RSI < 70)",
  "icon": "\ud83d\ude80",
  "generated_at": "2026-10-28T16:42:19.462419",
  "date": "2026-10-28",
  "total_matches": 193,
  "filter_criteria": "beta > 1.5 AND rsi_14 < 70",
  "tickers": [
    {
      "symbol": "ASST",
      "name": "Strive, Inc. - Class A Common Stock",
      "exchange": "NASDAQ",
      "sector": "Financial Services",
      "industry": "Asset Management",
      "price": 27.1,
      "volume": 1162507,
      "marketCap": 3427678976,
      "dividendYield": null,
      "beta": 13.24,
      "rsi": 46.4,
      "ma200": 16.4,
      "ma50": 26.51,
      "peRatio": null,
      "forwardPE": -92.83,
      "priceToBook": 3.41,
      "week52High": 34.4,
      "week52Low": 7.02,
      "scores": {
        "dividendDaddy": null,
        "moonShot": 100,
        "fallingKnife": 13,
        "overHyped": 34,
        "instWhale": 38,
        "reitRadar": null
      }
    },
    {
      "symbol": "CD",
      "name": "Chaince Digital Holdings Inc. - American Ordinary Shares",
      "exchange": "NASDAQ",
      "sector": "Financial Services",
      "industry": "Capital Markets",
      "price": 10.04,
      "volume": 153789,
      "marketCap": 1092337792,
      "dividendYield": null,
      "beta": 8.17,
      "rsi": 45.0,
      "ma200": 5.16,
      "ma50": 5.54,
      "peRatio": null,
      "forwardPE": null,
      "priceToBook": 16.86,
      "week52High": 14.1,
      "week52Low": 2.1,
      "scores": {
        "dividendDaddy": null,
        "moonShot": 99,
        "fallingKnife": 8,
        "overHyped": 31,
        "instWhale": 16,
        "reitRadar": null
      }
    },
    {
      "symbol": "BKKT",
      "name": "Bakkt Holdings, Inc. Class A Common Stock",
      "exchange": "NYSE",
      "sector": "Technology",
      "industry": "Software - Infrastructure",
      "price": 5.01,
      "volume": 225235,
      "marketCap": 226699376,
      "dividendYield": null,
      "beta": 6.07,
      "rsi": 15.0,
      "ma200": 9.01,
      "ma50": 7.38,
      "peRatio": null,
      "forwardPE": 5.24,
      "priceToBook": 0.64,
      "week52High": 28.5,
      "week52Low": 4.7,
      "scores": {
        "dividendDaddy": null,
        "moonShot": 99,
        "fallingKnife": 98,
        "overHyped": null,
        "instWhale": 2,
        "reitRadar": null
      }
    },
    {
      "symbol": "APLD",
      "name": "Applied Digital Corporation - Common Stock",
      "exchange": "NASDAQ",
      "sector": "Technology",
      "industry": "Information Technology Services",
      "price": 19.43,
      "volume": 10531121,
      "marketCap": 5851191296,
      "dividendYield": null,
      "beta": 6.0,
      "rsi": 33.8,
      "ma200": 31.5,
      "ma50": 24.43,
      "peRatio": null,
      "forwardPE": -24.67,
      "priceToBook": 3.59,
      "week52High": 50.73,
      "week52Low": 17.5,
      "scores": {
        "dividendDaddy": null,
        "moonShot": 99,
        "fallingKnife": 96,
        "overHyped": 12,
        "instWhale": 51,
        "reitRadar": null
      }
    },
    {
      "symbol": "HUT",
      "name": "Hut 8 Corp. - Common Stock",
      "exchange": "NASDAQ",
      "sector": "Financial Services",
      "industry": "Capital Markets",
      "price": 67.51,
      "volume": 1737136,
      "marketCap": 8274407936,
      "dividendYield": null,
      "beta": 5.92,
      "rsi": 36.5,
      "ma200": 82.47,
      "ma50": 84.83,
      "peRatio": null,
      "forwardPE": -13.04,
      "priceToBook": 5.73,
      "week52High": 140.8,
      "week52Low": 31.67,
      "scores": {
        "dividendDaddy": null,
        "moonShot": 99,
        "fallingKnife": 84,
        "overHyped": 17,
        "instWhale": 58,
        "reitRadar": null
      }
    },
    {
      "symbol": "CORZ",
      "name": "Core Scientific, Inc. - Common Stock",
      "exchange": "NASDAQ",
      "sector": "Technology",
      "industry": "Software - Infrastructure",
      "price": 14.47,
      "volume": 2987529,
      "marketCap": 4648189440,
      "dividendYield": null,
      "beta": 5.48,
      "rsi": 44.4,
      "ma200": 19.69,
      "ma50": 16.37,
      "peRatio": null,
      "forwardPE": 88.87,
      "priceToBook": -1.91,
      "week52High": 30.46,
      "week52Low": 12.31,
      "scores": {
        "dividendDaddy": null,
        "moonShot": 99,
        "fallingKnife": 88,
        "overHyped": 30,
        "instWhale": 46,
        "reitRadar": null
      }
    },
    {
      "symbol": "MARA",
      "name": "MARA Holdings, Inc. - Common Stock",
      "exchange": "NASDAQ",
      "sector": "Financial Services",
      "industry": "Capital Markets",
      "price": 7.05,
      "volume": 14077401,
      "marketCap": 2715143424,
      "dividendYield": null,
      "beta": 5.35,
      "rsi": 17.3,
      "ma200": 10.83,
      "ma50": 10.5,
      "peRatio": null,
      "forwardPE": -20.67,
      "priceToBook": 1.62,
      "week52High": 19.27,
      "week52Low": 6.62,
      "scores": {
        "dividendDaddy": null,
        "moonShot": 99,
        "fallingKnife": 97,
        "overHyped": 1,
        "instWhale": 32,
        "reitRadar": null
      }
    },
    {
      "symbol": "WULF",
      "name": "TeraWulf Inc. - Common Stock",
      "exchange": "NASDAQ",
      "sector": "Financial Services",
      "industry": "Capital Markets",
      "price": 12.7,
      "volume": 15466203,
      "marketCap": 6279520768,
      "dividendYield": null,
      "beta": 4.25,
      "rsi": 43.7,
      "ma200": 18.1,
      "ma50": 14.81,
      "peRatio": null,
      "forwardPE": -52.52,
      "priceToBook": 42.66,
      "week52High": 29.84,
      "week52Low": 10.35,
      "scores": {
        "dividendDaddy": null,
        "moonShot": 99,
        "fallingKnife": 91,
        "overHyped": 29,
        "instWhale": 52,
        "reitRadar": null
      }
    },
    {
      "symbol": "DJT",
      "name": "Trump Media & Technology Group Corp. - Common Stock",
      "exchange": "NASDAQ",
      "sector": "Communication Services",
      "industry": "Internet Content & Information",
      "price": 6.01,
      "volume": 3752567,
      "marketCap": 1662061056,
      "dividendYield": null,
      "beta": 4.1,
      "rsi": 18.1,
      "ma200": 9.39,
      "ma50": 8.4,
      "peRatio": null,
      "forwardPE": null,
      "priceToBook": 1.62,
      "week52High": 17.09,
      "week52Low": 5.94,
      "scores": {
        "dividendDaddy": null,
        "moonShot": 99,
        "fallingKnife": 97,
        "overHyped": 1,
        "instWhale": 22,
        "reitRadar": null
      }
    },
    {
      "symbol": "KEEL",
      "name": "Keel Infrastructure Corp. - Common Stock",
      "exchange": "NASDAQ",
      "sector": "Technology",
      "industry": "Information Technology Services",
      "price": 2.29,
      "volume": 10236500,
      "marketCap": 1404979072,
      "dividendYield": null,
      "beta": 4.01,
      "rsi": 17.5,
      "ma200": 3.45,
      "ma50": 3.22,
      "peRatio": null,
      "forwardPE": -5.72,
      "priceToBook": 4.27,
      "week52High": 7.37,
      "week52Low": 1.68,
      "scores": {
        "dividendDaddy": null,
        "moonShot": 99,
        "fallingKnife": 96,
        "overHyped": 1,
        "instWhale": 20,
        "reitRadar": null
      }
    },
    {
      "symbol": "CLSK",
      "name": "CleanSpark, Inc. - Common Stock",
      "exchange": "NASDAQ",
      "sector": "Financial Services",
      "industry": "Capital Markets",
      "price": 8.23,
      "volume": 6105571,
      "marketCap": 2095627264,
      "dividendYield": null,
      "beta": 3.84,
      "rsi": 21.4,
      "ma200": 12.39,
      "ma50": 11.69,
      "peRatio": null,
      "forwardPE": -4.66,
      "priceToBook": 2.75,
      "week52High": 20.85,
      "week52Low": 7.36,
      "scores": {
        "dividendDaddy": 1,
        "moonShot": 99,
        "fallingKnife": 96,
        "overHyped": 2,
        "instWhale": 27,
        "reitRadar": null
      }
    },
    {
      "symbol": "AAOI",
      "name": "Applied Optoelectronics, Inc. - Common Stock",
      "exchange": "NASDAQ",
      "sector": "Technology",
      "industry": "Communication Equipment",
      "price": 79.27,
      "volume": 4098815,
      "marketCap": 6739860992,
      "dividendYield": null,
      "beta": 3.84,
      "rsi": 29.4,
      "ma200": 113.77,
      "ma50": 100.76,
      "peRatio": null,
      "forwardPE": 17.25,
      "priceToBook": 4.02,
      "week52High": 233.67,
      "week52Low": 18.5,
      "scores": {
        "dividendDaddy": 1,
        "moonShot": 99,
        "fallingKnife": 94,
        "overHyped": 7,
        "instWhale": 54,
        "reitRadar": null
      }
    },
    {
      "symbol": "INBX",
      "name": "Inhibrx Biosciences, Inc. - Common Stock",
      "exchange": "NASDAQ",
      "sector": "Healthcare",
      "industry": "Biotechnology",
      "price": 73.54,
      "volume": 586900,
      "marketCap": 1061805504,
      "dividendYield": null,
      "beta": 3.82,
      "rsi": 34.5,
      "ma200": 92.15,
      "ma50": 103.42,
      "peRatio": null,
      "forwardPE": -8.24,
      "priceToBook": -20.03,
      "week52High": 155.29,
      "week52Low": 57.3,
      "scores": {
        "dividendDaddy": 1,
        "moonShot": 98,
        "fallingKnife": 87,
        "overHyped": 13,
        "instWhale": 16,
        "reitRadar": null
      }
    },
    {
      "symbol": "AFRM",
      "name": "Affirm Holdings, Inc. - Class A Common Stock",
      "exchange": "NASDAQ",
      "sector": "Financial Services",
      "industry": "Credit Services",
      "price": 72.03,
      "volume": 737045,
      "marketCap": 24427610112,
      "dividendYield": null,